title	category
Alria 16MP Ultra HD 4K WIFI Sports Action Camera with Sony IMX 179 Lens Waterproof Dvr Multipurpose Camcorder 170 Degree / 30m Wide Angle 2 inch LCD Screen/ Rechargeable Battery, Full Accessories Mounting Kits included Sports and Action Camera(Gold 16 MP)	1
Artek A Full HD Waterproof Sports and Action Camera(Black 1.3 MP)	1
Artek W9C Full HD Wifi Waterproof Sports and Action Camera(Multicolor 12 MP)	1
Astra 4kcamera Ultra hd 3840 Sports and Action Camera	1
Astra 4K camera Ultra hd 3840 Sports and Action Camera(Black 12 MP)	1
Autosity Detective Security 13 Mirror-Camera Glasses Spy Product Camcorder(Black)	1
Autosity Detective Security 16GBBL1289 Pen Spy Product Camcorder(Black)	1
Autosity Detective Security 16GB Hidden Spy Pen Camera For Video/Photo Recording Camcorder(Blue)	1
Autosity Detective Security 4GB DVR Video Hidden Camera-11 Button Spy Product Camcorder(Black)	1
Autosity Detective Security 4GB Inbuilt DVR Video Hidden Camera-11 Button Spy Product Camcorder(Black)	1
Autosity Detective Security 808-Key-Chain Key Chain Spy Product Camcorder(Black)	1
Autosity Detective Security A8 live Voice Recorder Spy Product Camcorder(Black)	1
Autosity Detective Security Black Leather Spy Watch Camcorder(Black)	1
Autosity Detective Security Black Spy Voice Recorder Camcorder(Black)	1
Autosity Detective Security Blue-Spy-Pen-16-GB Pen Spy Product Camcorder(Blue)	1
Autosity Detective Security c1 Button Spy Product Camcorder(Black)	1
Autosity Detective Security Camera Watch 4GB for Video/Photo Watch Spy Product Camcorder(Silver)	1
Autosity Detective Security Digital Camera Multi Function HD Clock Spy Product Camcorder(Silver)	1
Autosity Detective Security Dvr mini U8 pendrive camera Pen Drive Spy Product Camcorder(Black)	1
Autosity Detective Security DVR Video Hidden Camera-11 Button 4GB Spy Product Camcorder(Black)	1
Autosity Detective Security Electro a8 Voice Recorder Spy Product Camcorder(Black)	1
Autosity Detective Security Electro SC 07 Watch Spy Product Camcorder(Silver)	1
Autosity Detective Security Electro Spy BMW Key Camera Camcorder(Black)	1
Autosity Detective Security F01D Watch Spy Product Camcorder(Black)	1
Autosity Detective Security GF-08 Voice Recorder Spy Product Camcorder(Black)	1
Autosity Detective Security Glasses Spy Product Camcorder(Black)	1
Autosity Detective Security HD Night Vision function long duration Charger Camera. Support recording while charging .up to 32 gb support Camcorder(Black)	1
Autosity Detective Security HD Quality BMW Hidden Spy Keychain for Video/Photo Recording Camcorder(Black)	1
Autosity Detective Security HD Quality Hidden Spy Keychain for Video/Photo Recording Camcorder(Black)	1
Autosity Detective Security HD Spy Speck Camera With Hidden Video/Audio Recording 32GB Memory Support Camcorder(Black)	1
Autosity Detective Security Hidden 16GB Spy Pen Camera For Photo/Video Recording Camcorder(Black)	1
Autosity Detective Security Hidden Camera Pen Drive Spy Product Camcorder(Black)	1
Autosity Detective Security Hidden Pen Drive Camera for Video/ Photo/Audio Recording Camcorder(Black)	1
Autosity Detective Security Hidden Spy Pen for Video/Photo Recording Built In 32gb Pen Drive Camcorder(Black)	1
Autosity Detective Security Hidden Spy Pen for Video/photo Recording with Inbuilt 4gb Pen Drive Camcorder(Blue)	1
Autosity Detective Security inbuilt 32 GB Hd Pen Camera Camcorder Spy Product Camcorder(Red)	1
Autosity Detective Security J018-8GB Hook Spy Product Camcorder(Black)	1
Autosity Detective Security J018 Hook Spy Product Camcorder(Black)	1
Autosity Detective Security Leather Spy Watch Spy Product Camcorder(Black)	1
Autosity Detective Security Live Listening Device/Audio Trnsmtr Voice Recorder Spy Product Camcorder(Black)	1
Autosity Detective Security Look -1542 Watch Spy Product Camcorder(Black)	1
Autosity Detective Security MINI-U8 Pen Drive Spy Product Camcorder(Black)	1
Autosity Detective Security MP7 Pen Spy Product Camcorder(Black)	1
Autosity Detective Security Multi-function-multi-function Clock Spy Product Camcorder(Silver)	1
Autosity Detective Security Multifunction-table-clock Clock Spy Product Camcorder(Silver)	1
Autosity Detective Security N-09 GSM BUG Live Listening Device Voice Recorder Spy Product Camcorder(Black)	1
Autosity Detective Security Pen Camera Pen Spy Product Camcorder(Black)	1
Autosity Detective Security Red Spy Pen for Video/Photo Recording built in 4gb Pen Drive Camcorder(Red)	1
Autosity Detective Security Remote Center Lock BMW HD Camera Key Chain Spy Product Camcorder(Black)	1
Autosity Detective Security Round-Steel-Table-Clock Clock Spy Product Camcorder(Silver)	1
Autosity Detective Security S818-819 16GB BMW Camera Key Chain Spy Product Camcorder(Black)	1
Autosity Detective Security S-918-BMW-8 GB Key Chain Spy Product Camcorder(Black)	1
Autosity Detective Security S918-S818-BMW Button Spy Product Camcorder(Black)	1
Autosity Detective Security Safari -2 Watch Spy Product Camcorder(Silver)	1
Autosity Detective Security Silver HD Camera Clock Spy Product Camcorder(Silver)	1
Autosity Detective Security Silver HD Camera Watch Spy Product Camcorder(Silver)	1
Autosity Detective Security Silver Ring Clock Spy Product Camcorder(Silver)	1
Autosity Detective Security Sinita P1 Button Spy Product Camcorder(Black)	1
Autosity Detective Security Sports Wrist Wacth Silver Watch Spy Product Camcorder(Silver)	1
Autosity Detective Security Spy Camera Watch Clock Spy Product Camcorder(Black)	1
Autosity Detective Security Spy Key Chain Spy Camera Camcorder(Black)	1
Autosity Detective Security Spy Wrist Watch Camera Video/Audio Recording,While recording no light Flashes,Inbuilt 4GB memory Camcorder(Silver)	1
Autosity Detective Security Steel-Wrist-Watch Watch Spy Product Camcorder(Silver)	1
Autosity Detective Security Stylish HD Camera USB Pen Drive Spy Product Camcorder(Black)	1
Autosity Detective Security Stylish Smile Booch HD Camera Clothes Spy Product Camcorder(Yellow)	1
Autosity Detective Security Trendy Micro Button Spy Product Camcorder(Black)	1
Autosity Detective Security U8 Pen Drive Spy Product Camcorder(Black)	1
Autosity Detective Security USB Pendrive Voice Recorder - Black Camcorder(Black)	1
Autosity Detective Security USB Stylish Pen Drive Spy Product Camcorder(Black)	1
Autosity Detective Security Voice Recorder Spy Product Camcorder(Blue)	1
Autosity Detective Security w00212 Watch Spy Product Camcorder(Black)	1
Autosity Detective Security Watch Spy Product Camcorder(Black)	1
Autosity Detective Security Wifi Mini Drive Spy Product Camcorder(Black)	1
Autosity Detective Security Wifi MN7 Button Spy Product Camcorder(Black)	1
Autosity Detective Security Wrist Watch Hidden Recording Camera While recording no light Flashes,Watch Camera Inbuilt 4GB Memory Camcorder(Silver)	1
Autosity Detective Security Yellow Smiley Spy Camera Camcorder(Yellow)	1
Autosity Detective Survilliance 16GB 5MP Camera Pen Spy Product Camcorder(Blue)	1
Autosity Detective Survilliance 16GB Hidden Spy Pen Camera For Video/Photo Recording Camcorder(Blue)	1
Autosity Detective Survilliance 16 GB Inbuilt Memory HD Pen Spy Camera Product Camcorder(Black)	1
Autosity Detective Survilliance 16 GB Memory Inbuilt Black Pen Camera Spy Product Camcorder(Black)	1
Autosity Detective Survilliance 16 GB Memory Inbuilt Black Stylish Pen Camera Spy Camcorder(Black)	1
Autosity Detective Survilliance 16 GB Memory Inbuilt Pen Camera Spy Product Camcorder(Black)	1
Autosity Detective Survilliance 32 GB Business Portable Recorder Pen Spy Camera Product Camcorder(Blue)	1
Autosity Detective Survilliance 32GB Hidden Photo/Video Pen Spy Product Camcorder(Blue)	1
Autosity Detective Survilliance 32 GB Memory Inbuilt Black Pen Spy Camera Product Camcorder(Black)	1
Autosity Detective Survilliance 32 GB Memory Inbuilt FW4GBL Pen Spy Product Camcorder(Black)	1
Autosity Detective Survilliance 32 GB Memory Inbuilt Red Pen Spy Camera Product Camcorder(Red)	1
Autosity Detective Survilliance 4GB DVR Video Hidden Camera-11 Button Spy Product Camcorder(Black)	1
Autosity Detective Survilliance 4 GB Memory Inbuilt Button Spy Camera Product Camcorder(Black)	1
Autosity Detective Survilliance 4 GB Memory Inbuilt Chain Wrist Watch Spy Camera Product Camcorder(Black)	1
Autosity Detective Survilliance 808-8GB Key Chain Camera Spy Product Camcorder(Black)	1
Autosity Detective Survilliance 918-Button-HD-CarDVR Button Spy Product Camcorder(Black)	1
Autosity Detective Survilliance Ash Tray Black HD Camera Spy Product Camcorder(Black)	1
Autosity Detective Survilliance Ash Tray Black with Cable Spy Camera Product Camcorder(Black)	1
Autosity Detective Survilliance Assured Pendrive camera with 16gb Card Camcorder(Black)	1
Autosity Detective Survilliance Bat Pen Spy Product Camcorder(Black)	1
Autosity Detective Survilliance Black 4 GB Pen Camera Inbuilt Spy Product Camcorder(Black)	1
Autosity Detective Survilliance Black Audio Transmitter For Live Listening Camcorder(Black)	1
Autosity Detective Survilliance Black Digital Multi Function Camera Spy Product Camcorder(Black)	1
Autosity Detective Survilliance Black Digital Table Clock Spy Camera Product Camcorder(Black)	1
Autosity Detective Survilliance Black HD Camera Button Spy Product Camcorder(Black)	1
Autosity Detective Survilliance Black Spy Button Camera Camcorder(Black)	1
Autosity Detective Survilliance Black Spy Voice Recorder Camcorder(Black)	1
Autosity Detective Survilliance Blue Mini U8 Pen Drive Spy Camera Product Camcorder(Blue)	1
Autosity Detective Survilliance Bug N-09 Spy Product Camcorder(Black)	1
Autosity Detective Survilliance Button Camera and Pen Bat Spy Products Camcorder(Black)	1
Autosity Detective Survilliance C-01 Button Spy Camera Product Camcorder(Black)	1
Autosity Detective Survilliance Camera 32 GB Memory Inbuilt Black Pen Spy Product Camcorder(Black)	1
Autosity Detective Survilliance Camera Cap Clothes Spy Product Camcorder(Black)	1
Autosity Detective Survilliance Card Mini HD Button Camera Spy Item Camcorder(Black)	1
Autosity Detective Survilliance Car DVR Comcoder Spy Product Camcorder(Black)	1
Autosity Detective Survilliance Charger HD Camera with Remote Charger Spy Product Camcorder(Black)	1
Autosity Detective Survilliance Clock Spy Camera Product Camcorder(White)	1
Autosity Detective Survilliance Clock Table Spy Camera Product Camcorder(Black)	1
Autosity Detective Survilliance Digital Camera with Remote Clock Spy Product Camcorder(Black)	1
Autosity Detective Survilliance Digital Multi Function Clock Spy Camera Product Camcorder(Black)	1
Autosity Detective Survilliance Dvr mini U8 pendrive camera Pen Drive Spy Product Camcorder(Black)	1
Autosity Detective Survilliance Electric Board Socket Spy Camera Product Camcorder(White)	1
Autosity Detective Survilliance Eye Glass Goggle Spy Camera Product Camcorder(Black)	1
Autosity Detective Survilliance F01D Watch Spy Camera Product Camcorder(Black)	1
Autosity Detective Survilliance FW4GBL Pen Spy Product Camcorder(Black)	1
Autosity Detective Survilliance GF-08 GSM Audio and Video Talking Locator Spy Camera Product Camcorder(Black)	1
Autosity Detective Survilliance GF-08 Voice Recorder Spy Product Camcorder(Black)	1
Autosity Detective Survilliance GSM N09 Bug Spy Camera Camcorder(Black)	1
Autosity Detective Survilliance HD 5 Button Spy Product Camcorder(Black)	1
Autosity Detective Survilliance HD Audio / Video Recording BMW Keychain Spy Camera while recording No light Flashes 32GB Memory Supportable. Camcorder(Black)	1
Autosity Detective Survilliance HD-Bat-Pen Spy Camera Product Camcorder(Black)	1
Autosity Detective Survilliance HD Pen Camera Spy Camcorder(Black)	1
Autosity Detective Survilliance HD Quality BMW Hidden Spy Keychain for Video/Photo Recording Camcorder(Black)	1
Autosity Detective Survilliance HD Quality Hidden Spy Keychain for Video/Photo Recording Camcorder(Black)	1
Autosity Detective Survilliance HD Quality Spy Pen For Video/Photo Recording Camcorder(Black)	1
Autosity Detective Survilliance HD SPY PEN CAMERA Pen Spy Product Camcorder(Blue)	1
Autosity Detective Survilliance Hidden 16GB Spy Pen Camera For Photo/Video Recording Camcorder(Black)	1
Autosity Detective Survilliance Hidden Camera Clock For Video/Photo Clock Spy Product Camcorder(Silver)	1
Autosity Detective Survilliance Hidden Camera Pen Drive Spy Product Camcorder(Black)	1
Autosity Detective Survilliance Hidden Pen Drive Camera for Video/ Photo/Audio Recording Camcorder(Black)	1
Autosity Detective Survilliance Hidden Pen Drive Camera for Video/Photo/ Recording Camcorder(Black)	1
Autosity Detective Survilliance Hidden Slim Button Camera with Inbuilt 4gb Genuine Camcorder(Black)	1
Autosity Detective Survilliance Hidden Spy Button Camera for Video & Photo Recording -Black Camcorder(Black)	1
Autosity Detective Survilliance Hidden Spy Goggles for Video/Photo Recording Camcorder(Black)	1
Autosity Detective Survilliance Inbuilt 32 GB Memory HD Camera Pen Spy Product Camcorder(Black)	1
Autosity Detective Survilliance inbuilt Hd Pen Camera Camcorder Spy Product Camcorder(Red)	1
Autosity Detective Survilliance J-018 Hook Spy Product Camcorder(Black)	1
Autosity Detective Survilliance J018 Hook Spy Product Camcorder(Black)	1
Autosity Detective Survilliance Key-Camera Key Chain Spy Product Camcorder(Black)	1
Autosity Detective Survilliance Key Chain Black Spy Camera Product Camcorder(Black)	1
Autosity Detective Survilliance Leather Spy Watch Spy Product Camcorder(Black)	1
Autosity Detective Survilliance Leather Wrist Watch (sc) Spy Product Camera Camcorder(Black)	1
Autosity Detective Survilliance Live Listening Device and Audio Transmitter -Black Camcorder(Black)	1
Autosity Detective Survilliance Mini A-08 Bug Camcorder(Black)	1
Autosity Detective Survilliance Mini DV 8 GB Voice Recorder Camcorder(Black)	1
Autosity Detective Survilliance MINI-U8 Pen Drive Spy Product Camcorder(Black)	1
Autosity Detective Survilliance Mirror-Camera Glasses Spy Product Camcorder(Black)	1
Autosity Detective Survilliance mn7 Button Spy Product Camcorder(Black)	1
Autosity Detective Survilliance Mobile Charger Spy Camera Product Camcorder(Black)	1
Autosity Detective Survilliance Moda Silva USB 1R Pen Spy Camera Product Camcorder(Red)	1
Autosity Detective Survilliance N-09 GSM Audio Bug Spy Product Camcorder(Black)	1
Autosity Detective Survilliance N-09 GSM BUG Live Listening Device Voice Recorder Spy Product Camcorder(Black)	1
Autosity Detective Survilliance Night Vision function long duration Charger Camera. Support recording while charging .up to 32 gb support Camcorder(Black)	1
Autosity Detective Survilliance Pen Bat Spy Camera HD Black Camcorder(Black)	1
Autosity Detective Survilliance Pen Camera Pen Spy Product Camcorder(Black)	1
Autosity Detective Survilliance Pen Drive Spy Product Camcorder(Black)	1
Autosity Detective Survilliance Remote Center Lock Style BMW HD Camera Key Chain Spy Product Camcorder(Black)	1
Autosity Detective Survilliance Remote Key Chain BMW Spy Product Camera Camcorder(Black)	1
Autosity Detective Survilliance Round-Steel-Table-Clock Spy Camera Product Camcorder(Silver)	1
Autosity Detective Survilliance S-918-BMW-8 GB Key Chain Spy Product Camcorder(Black)	1
Autosity Detective Survilliance S918-HD-Bat Pen and Button Spy Product Camcorder(Black)	1
Autosity Detective Survilliance S918 MINI HD BUTTON Spy Camera Product Camcorder(Black)	1
Autosity Detective Survilliance SC-07 16gb sports watch Watch Spy Product Camcorder(Silver)	1
Autosity Detective Survilliance (sc) Based Chain Hand DVR Watch Spy Product Camcorder(Silver)	1
Autosity Detective Survilliance (sc) Survilliance Wrist Watch Spy Camera Camcorder(Black)	1
Autosity Detective Survilliance SG015 Glasses Spy Product Camcorder(Black)	1
Autosity Detective Survilliance Silver Multi Funtion Digital Spy Camera Clock Camcorder(Silver)	1
Autosity Detective Survilliance Silver Stylish Pen Camera HD Spy Product Camcorder(Black)	1
Autosity Detective Survilliance Speck-v13-2 Glasses Spy Product Camcorder(Black)	1
Autosity Detective Survilliance Sporty Look Black C00212 Watch Spy Camera product Camcorder(Black)	1
Autosity Detective Survilliance Spy Button Camera With 8GB Card Camcorder(Black)	1
Autosity Detective Survilliance Spy Camera Watch Clock Spy Product Camcorder(Black)	1
Autosity Detective Survilliance Spy Pen for Video/Photo Recording with Inbuilt 16GB Pen Drive Blue Camcorder(Blue)	1
Autosity Detective Survilliance Spy Wrist Watch Hidden Camera With Audio/Video Recording Inbuilt 16GB Memory. Camcorder(Black)	1
Autosity Detective Survilliance Spy Wrist Watch Hidden Camera With Audio /Video Recording Inbuilt 16GB Memory. Camcorder(Silver)	1
Autosity Detective Survilliance Stylish Black Digital Clock Spy Camera Product Camcorder(Black)	1
Autosity Detective Survilliance Stylish Black N0002 Button Spy Camera Product Camcorder(Black)	1
Autosity Detective Survilliance Stylish Chain Wrist Watch HD Camera Spy Camcorder(Black)	1
Autosity Detective Survilliance Stylish Eye Glasses HD Glasses Spy Camera Product Camcorder(Black)	1
Autosity Detective Survilliance Stylish HD Camera USB Pen Drive Spy Product Camcorder(Black)	1
Autosity Detective Survilliance Stylish Shape Remote Spy Camera Product Camcorder(Black)	1
Autosity Detective Survilliance Stylish Sporty Look -1550 Watch Chain Spy Camera Product Camcorder(Silver)	1
Autosity Detective Survilliance Stylish Wrist Watch Brown Spy Product Camcorder(Black)	1
Autosity Detective Survilliance Stylish Wrist Watch Spy Camera Camcorder(Black)	1
Autosity Detective Survilliance Sunglasses HD Camera Glasses Spy Product Camcorder(Black)	1
Autosity Detective Survilliance Tie Stylish Blue Spy Camera Product Camcorder(Black)	1
Autosity Detective Survilliance Tie Stylish Spy Camera Product Camcorder(Blue)	1
Autosity Detective Survilliance Tuzuka U8 DVR Pen Drive Spy Product Camcorder(Black)	1
Autosity Detective Survilliance Upper Wearing Button Camera Spy Product Camcorder(Black)	1
Autosity Detective Survilliance USB HD Camera Pen Drive Spy Product Camcorder(Black)	1
Autosity Detective Survilliance USB Pendrive Voice Recorder - Black Camcorder(Black)	1
Autosity Detective Survilliance Voice Recorder Spy Product Camcorder(Black)	1
Autosity Detective Survilliance Yellow Smile Booch HD Spy Camera Product Camcorder(Yellow)	1
Autosity Secrete Detective 13 Mirror-Camera Glasses Spy Product Camcorder(Black)	1
Autosity Secrete Detective 16Gb Hidden Camera Pen Spy Product Camcorder(Blue)	1
Autosity Secrete Detective 808-8GB Key Chain Spy Product Camcorder(Black)	1
Autosity Secrete Detective B0002 Button Spy Product Camcorder(Black)	1
Autosity Secrete Detective Best Quality Pen Camera Video/ Audio Hidden Recording Pen Camera with Inbuilt 16 Gb Memory. Camcorder(Blue)	1
Autosity Secrete Detective Black Ash Tray Spy Camera Product Camcorder(Black)	1
Autosity Secrete Detective Black Audio Transmitter For Live Listening Camcorder(Black)	1
Autosity Secrete Detective Black Leather Spy Watch Camcorder(Black)	1
Autosity Secrete Detective Black Sports Spy Watch Camcorder(Black)	1
Autosity Secrete Detective Button Clothes Spy Camera Product Camcorder(Black)	1
Autosity Secrete Detective Camera 32 GB Memory Inbuilt Black Pen Spy Product Camcorder(Black)	1
"Autosity Secrete Detective DVR-2.5-Car Car DVR Spy Product Camcorder(Black)"""	1
Autosity Secrete Detective HD Audio / Video Recording BMW Keychain Spy Camera while recording No light Flashes 32GB Memory Supportable. Camcorder(Black)	1
Autosity Secrete Detective HD-Bat-Pen Pen Spy Product Camcorder(Black)	1
Autosity Secrete Detective HD Nice Quality Bluetooth Camera Hidden VIDEO AUDIO RECORDING BLUETOOTH CAMERA Inbuilt 4GB Memory. Camcorder(Black)	1
Autosity Secrete Detective HD Night Vision function long duration Charger Camera. Support recording while charging .up to 32 gb support Camcorder(Black)	1
Autosity Secrete Detective HD Quality Spy Pen For Video/Photo Recording Camcorder(Black)	1
Autosity Secrete Detective HD Spy Speck Camera With Hidden Video/Audio Recording 32GB Memory Support Camcorder(Black)	1
Autosity Secrete Detective Hidden Camera Spy Wrist Watch fro Video/Photo Recording Camcorder(Silver)	1
Autosity Secrete Detective Hidden Pen Drive Camera for Video/ Photo/Audio Recording Camcorder(Black)	1
Autosity Secrete Detective Hidden Spy Goggles for Video/Photo Recording Camcorder(Black)	1
Autosity Secrete Detective Hidden Spy Keychain Camera for Recording Camcorder(Black)	1
Autosity Secrete Detective inbuilt Hd Pen Camera Camcorder Spy Product Camcorder(Red)	1
Autosity Secrete Detective Round-Steel-Table-Clock Clock Spy Product Camcorder(Silver)	1
Autosity Secrete Detective Silver HD Camera Watch Spy Product Camcorder(Silver)	1
Autosity Secrete Detective Silver Multi Funtion Digital Spy Clock Camcorder(Silver)	1
Autosity Secrete Detective Spy hd Slimmest Button camera inbuilt 4GB Camcorder(Black)	1
Autosity Secrete Detective Spy Wrist Watch Hidden Audio/video Recording .While recording no light Flashes.Inbuilt 4GB memory. Camcorder(Black)	1
Autosity Secrete Detective Sunglasses Camera Glasses Spy Product Camcorder(Black)	1
Autosity Secrete Detective Wall-Clock Clock Spy Product Camcorder(White)	1
Autosity Secrete Detective White Plastic Socket Spy Camera with Video Recording Camcorder(White)	1
Autosity Secrete Detective White Stylish Wall Clock Spy Product Camcorder(White)	1
Autosity Secrete Detective Wifi Ash Tray Cable Spy Product Camcorder(Black)	1
Autosity Secrete Detective World FW4GBL Pen Spy Product Camcorder(Black)	1
Autosity Secrete Detective Yellow Metal Smiley Hidden Camera Camcorder(Yellow)	1
balrama 10pc 9 VOLTS BATTERY HI-WATT 100% Original 6F22 9V Long Life Carbon Zinc Batteries Camera Battery Pack(No)	1
Barbie digital camera Body only Point & Shoot Camera(Pink)	1
Benison India ��1080P Super Shot Cam Holder Sports & Action Camera(Black)	1
"Benison India ��1.5 LCD Waterproof Cam Holder Sports & Action Camera(Black)"""	1
Benison India ��2.0-Inch Stunt Underwater Cam Holder Sports & Action Camera(Black)	1
Benison India ��Full HD 12MP 1080P Black Helmet Waterproof Cam Holder Sports & Action Camera(Black)	1
Benison India �� Full HD Waterproof Cam Holder Sports & Action Camera(Black)	1
Benison India ��Mini Ultra HD 1080P DV Recorder Camcorder Waterproof Cam Holder Sports & Action Camera(Black)	1
Benison India �� Mini Underwater 1080p HD Cam Holder Sports & Action Camera(Black)	1
Benison India Powershot Go Pro 1080P Full HD Waterproof Digital with led screen Sports and Action Camera(Black 12 MP)	1
Benison India ��SportsAction Cam Holder Sports & Action Camera(Black)	1
Benison India ��Waterproof Camcorder 1080P mini HD Cam Holder Sports & Action Camera(Black)	1
Benison India ��Waterproof Cam Holder Sports & Action Camera(Black)	1
Benison India �� Waterproof Helmet HD 1080p Cam Holder Sports & Action Camera(Black)	1
Black Cat NA Sports and Action Camera(Black 12 MP)	1
Canon 1300D DSLR Camera With Sigma 70 - 300 mm F4-5.6 DG Macro for Canon Digital SLR Lens(Black)	1
Canon 1300D DSLR Camera With Tamron AF 70 - 300 mm F/4-5.6 Di LD Macro for Canon Digital SLR Lens(Black)	1
Canon 5D Mark IV DSLR Camera (Body only)(Black)	1
Canon 80D DSLR Camera Body with 18-135 IS USM(Black)	1
Canon A1400 Point & Shoot Camera(Black)	1
Canon Digital IXUS 160 Point & Shoot Camera(Black)	1
Canon Digital IXUS 160 Point & Shoot Camera(Red)	1
Canon Digital IXUS 160 Point & Shoot Camera(Silver)	1
Canon Digital IXUS 170 Point & Shoot Camera(Black)	1
Canon Digital IXUS 170 Point & Shoot Camera(Silver)	1
Canon Digital IXUS 275 HS Point & Shoot Camera(Black)	1
Canon Digital IXUS 510 HS Point & Shoot Camera(Black)	1
Canon DSLR Camera 24-70mm(Black)	1
Canon DSLR Camera(Black)	1
Canon DSLR Camera (Kit 24 - 105)(Black)	1
Canon EOS 100D (Body with 18-55 mm Lens) DSLR Camera(Black)	1
Canon EOS 100D dslr DSLR Camera(Black)	1
Canon EOS 1100D DSLR Camera (Body only)(Grey)	1
Canon EOS 1100D DSLR Camera (Body with EF-S 18-55 mm IS II & EF-S 55-250 mm Lenses)(Black)	1
Canon EOS 1100D DSLR Camera (Body with EF-S 18-55 mm IS II Lens)(Black)	1
Canon EOS 1200D DSLR Camera (Body with 8 GB Card & Bag EF S18-55 IS II+55-250mm IS II)(Black)	1
Canon EOS 1200D (Kit with EF S18-55 IS II) DSLR Camera(Black)	1
Canon EOS 1300D DSLR Camera (Body with EF-S 18 - 55 IS II)(Black)	1
Canon EOS 1300D DSLR Camera (Body with EF-S 18 - 55 IS II)(Grey)	1
Canon EOS 1300D DSLR Camera (Body with EF-S 18 - 55 mm IS II + EF-S 55 - 250 mm F4 5.6 IS II)(Black)	1
Canon EOS 1DX DSLR Camera (Body only)(Black)	1
Canon EOS 200D DSLR Camera EF-S18-55 IS STM(Black)	1
Canon EOS 200D DSLR Camera EF-S18-55 IS STM+ EF-S 55-250 mm IS II(Black)	1
Canon EOS 5D Mark III DSLR Camera (Body only)(Black)	1
Canon EOS 5D Mark IV DSLR Camera Body with��EF 24-105mm IS II USM Lens(Black)	1
Canon EOS 5DS Body DSLR Camera (Body only)(Black)	1
Canon EOS 5DS R Body DSLR Camera (Body only)(Black)	1
Canon EOS 600D (Body with EF-S 18-135 mm IS II Lens) DSLR Camera (Body only)(Black)	1
Canon EOS 600D (Body with EF-S 18-55 mm IS II & EF-S 55-250 mm IS II Lenses) DSLR Camera(Black)	1
Canon EOS 600D DSLR Camera (Body with EF-S 18-55 mm IS II Lens)(Black)	1
Canon EOS 60D DSLR Camera (Body only)(Black)	1
Canon EOS 6D Mark II DSLR Camera Body(Black)	1
Canon EOS 6D Mark II DSLR Camera EF24-105mm f/4L IS II USM(Black)	1
Canon EOS 6D Mark II DSLR Camera EF 24-70mm f/4L IS USM(Black)	1
Canon EOS 700D (Body only) DSLR Camera(Black)	1
Canon EOS 700D DSLR Camera (Body only)(Black)	1
Canon EOS 700D DSLR Camera (Body with EF S18 - 55 mm IS II and EF S55 - 250 mm IS II)(Black)	1
Canon EOS 70D (Body only) DSLR Camera(Black)	1
Canon EOS 70D DSLR Camera (Body only)(Black)	1
Canon EOS 70D DSLR Camera (Body with EF-S 18-55 mm IS STM Lens)(Black)	1
Canon EOS 750D DSLR Camera (Body only)(Black)	1
Canon EOS 750D (Kit -EF-S 18 - 55 mm IS STM) DSLR Camera(Black)	1
Canon EOS 760D DSLR Camera (Body only)(Black)	1
Canon EOS 760D (Kit with EF-S 18 - 135 mm IS STM) DSLR Camera(Black)	1
Canon EOS 77D DSLR Camera Body Only(Black)	1
Canon EOS 77D DSLR Camera Kit (EF-S18-135 IS USM)(Black)	1
