title	category
SPYCLOUD Secrete Detective Camera Based Hidden Camera Spy Wrist Watch fro Video/Photo Recording Camcorder(Silver)	1
SPYCLOUD Secrete Detective Camera Based Hidden Pen Drive Camera for Video/ Photo/Audio Recording Camcorder(Black)	1
SPYCLOUD Secrete Detective Camera Based Hidden Slim Button Camera with Inbuilt 4gb Genuine Camcorder(Black)	1
SPYCLOUD Secrete Detective Camera Based J018 Hook Spy Product Camcorder(Black)	1
SPYCLOUD Secrete Detective Camera Based Leather Wrist Watch Spy Camera Inbuilt 16GB memory,Hidden audio /video Recording.While recording no light Flashes Camcorder(Black)	1
SPYCLOUD Secrete Detective Camera Based Look -1542 Watch Spy Product Camcorder(Black)	1
SPYCLOUD Secrete Detective Camera Based Mini DV 8 GB Voice Recorder Camcorder(Black)	1
SPYCLOUD Secrete Detective Camera Based N-09 GSM BUG Live Listening Device Voice Recorder Spy Product Camcorder(Black)	1
SPYCLOUD Secrete Detective Camera Based Pen Drive Spy Product Camcorder(Black)	1
SPYCLOUD Secrete Detective Camera Based Remote Center Lock BMW HD Camera Key Chain Spy Product Camcorder(Black)	1
SPYCLOUD Secrete Detective Camera Based Round-Steel-Table-Clock Clock Spy Product Camcorder(Silver)	1
SPYCLOUD Secrete Detective Camera Based S818-S918 Key Chain Spy Product Camcorder(Black)	1
SPYCLOUD Secrete Detective Camera Based SC-07 16gb sports watch Watch Spy Product Camcorder(Silver)	1
SPYCLOUD Secrete Detective Camera Based (sc) Surveillance Camera Wrist Watch Spy Product Camcorder(Black)	1
SPYCLOUD Secrete Detective Camera Based SG015 Glasses Spy Product Camcorder(Black)	1
SPYCLOUD Secrete Detective Camera Based Silver HD Camera Clock Spy Product Camcorder(Silver)	1
SPYCLOUD Secrete Detective Camera Based Silver HD Camera Watch Spy Product Camcorder(Silver)	1
SPYCLOUD Secrete Detective Camera Based Speck-v13-1 Glasses Spy Product Camcorder(Black)	1
SPYCLOUD Secrete Detective Camera Based Speck-v13-2 Glasses Spy Product Camcorder(White)	1
SPYCLOUD Secrete Detective Camera Based Spy hd Slimmest Button camera inbuilt 4GB Camcorder(Black)	1
SPYCLOUD Secrete Detective Camera Based Spy Key Key Chain Spy Product Camcorder(Black)	1
SPYCLOUD Secrete Detective Camera Based Spy Pendrive Camera with 8GB Card Camcorder(Black)	1
SPYCLOUD Secrete Detective Camera Based Spy Reading Glasses Camera With HD Quality Recording.While recording no light Flashes.32gb memory supportable Camcorder(Black)	1
SPYCLOUD Secrete Detective Camera Based Spy Wrist Watch Camera Video/Audio Recording,While recording no light Flashes,Inbuilt 4GB memory Camcorder(Silver)	1
SPYCLOUD Secrete Detective Camera Based Spy Wrist Watch Hidden Audio/video Recording .While recording no light Flashes.Inbuilt 4GB memory. Camcorder(Black)	1
SPYCLOUD Secrete Detective Camera Based Spy Wrist Watch Hidden Camera With Audio /Video Recording Inbuilt 16GB Memory. Camcorder(Silver)	1
SPYCLOUD Secrete Detective Camera Based Spy Wrist Watch Hidden Camera With Audio /Video Recording Inbuilt 4GB Memory. Camcorder(Silver)	1
SPYCLOUD Secrete Detective Camera Based Spy Wrist Watch Hidden Camera With Audio /Video Recording Inbuilt 8GB Memory. Camcorder(Silver)	1
SPYCLOUD Secrete Detective Camera Based Steel-Wrist-Watch Watch Spy Product Camcorder(Silver)	1
SPYCLOUD Secrete Detective Camera Based Stylish Watch Spy Product Camcorder(Black)	1
SPYCLOUD Secrete Detective Camera Based Sunglasses Camera Glasses Spy Product Camcorder(Black)	1
SPYCLOUD Secrete Detective Camera Based USB Pendrive Voice Recorder - Black Camcorder(Black)	1
SPYCLOUD Secrete Detective Camera Based w00212 Watch Spy Product Camcorder(Black)	1
SPYCLOUD Secrete Detective Camera Based Watch Spy Product Camcorder(Black)	1
SPYCLOUD Secrete Detective Camera Black Spy Button Camera Camcorder(Black)	1
SPYCLOUD Secrete Detective Camera Camera Watch 4GB for Video/Photo Watch Spy Product Camcorder(Black)	1
SPYCLOUD Secrete Detective Camera F01D Watch Spy Product Camcorder(Black)	1
SPYCLOUD Secrete Detective Camera Hidden Button Camera with Inbuilt 4gb Genuine Camcorder(Black)	1
SPYCLOUD Secrete Detective Camera Hidden Camera Spy Wrist Watch fro Video/Photo Recording Camcorder(Silver)	1
SPYCLOUD Secrete Detective Camera Hidden Slim Button Camera with Inbuilt 4gb Genuine Camcorder(Black)	1
SPYCLOUD Secrete Detective Camera J018 Hook Spy Product Camcorder(Black)	1
SPYCLOUD Secrete Detective Camera Keychain Camera Key Chain Spy Product Camcorder(Black)	1
SPYCLOUD Secrete Detective Camera Mini DV 8 GB Voice Recorder Camcorder(Black)	1
SPYCLOUD Secrete Detective Camera N-09 GSM BUG Live Listening Device Voice Recorder Spy Product Camcorder(Black)	1
SPYCLOUD Secrete Detective Camera Night vison watch_2 Watch Spy Product Camcorder(Black)	1
SPYCLOUD Secrete Detective Camera S818-S918 Key Chain Spy Product Camcorder(Black)	1
SPYCLOUD Secrete Detective Camera (sc) Black Leather Spy Watch Camcorder(Black)	1
SPYCLOUD Secrete Detective Camera (sc) Surveillance Based Chain Hand Watch Spy Product Camcorder(Black)	1
SPYCLOUD Secrete Detective Camera Silver HD Camera Watch Spy Product Camcorder(Black)	1
SPYCLOUD Secrete Detective Camera Slimest Button Camera with Inbuilt 4gb Genuine Camcorder(Black)	1
SPYCLOUD Secrete Detective Camera Spy hd Slimmest Button camera inbuilt 4GB Camcorder(Black)	1
SPYCLOUD Secrete Detective Camera Spy Wrist Watch Hidden Audio/video Recording .While recording no light Flashes.Inbuilt 4GB memory. Camcorder(Black)	1
SPYCLOUD Secrete Detective Camera Steel-Wrist-Watch Watch Spy Product Camcorder(Silver)	1
SPYCLOUD Secrete Detective Camera White Plastic Socket Spy Camera with Video Recording Camcorder(Black)	1
SPYCLOUD Secrete Detective Camera Wifi Mini Drive Headset Spy Product Camcorder(Black)	1
SPYCLOUD Secrete Detective DVR Clock Spy Product Camcorder(Multicolor)	1
SPYCLOUD Secrete Detective Electro a8 Voice Recorder Spy Product Camcorder(Black)	1
SPYCLOUD Secrete Detective Electro SG015 Glasses Spy Product Camcorder(Black)	1
SPYCLOUD Secrete Detective Electro Spy BMW Key Camera Camcorder(Black)	1
SPYCLOUD Secrete Detective HD Night Vision function long duration Charger Camera. Support recording while charging .up to 32 gb support Camcorder(Black)	1
SPYCLOUD Secrete Detective HD Quality Hidden Spy Keychain for Video/Photo Recording Camcorder(Black)	1
SPYCLOUD Secrete Detective HD-Steelclock-16gb-DVR Clock Spy Product Camcorder(Silver)	1
SPYCLOUD Secrete Detective Hidden Pen Drive Camera for Video/ Photo/Audio Recording Camcorder(Black)	1
SPYCLOUD Secrete Detective Hidden Spy Pen for Video/Photo Recording Built In 32gb Pen Drive Camcorder(Black)	1
SPYCLOUD Secrete Detective inbuilt 32 GB Hd Pen Camera Camcorder Spy Product Camcorder(Red)	1
SPYCLOUD Secrete Detective J018 Hook Spy Product Camcorder(Black)	1
SPYCLOUD Secrete Detective Live Listening Device/Audio Trnsmtr Voice Recorder Spy Product Camcorder(Black)	1
SPYCLOUD Secrete Detective Live Listening or Audio Transmitter Voice Recorder Spy Product Camcorder(Black)	1
SPYCLOUD Secrete Detective Look -1542 Watch Spy Product Camcorder(Black)	1
SPYCLOUD Secrete Detective MINI-U8 Pen Drive Spy Product Camcorder(Black)	1
SPYCLOUD Secrete Detective MP7 Pen Spy Product Camcorder(Black)	1
SPYCLOUD Secrete Detective Multi-function-multi-function Clock Spy Product Camcorder(Silver)	1
SPYCLOUD Secrete Detective Red Spy Pen for Video/Photo Recording built in 4gb Pen Drive Camcorder(Red)	1
SPYCLOUD Secrete Detective S818-S918-2-BMW Key Chain Spy Product Camcorder(Black)	1
SPYCLOUD Secrete Detective S-918-BMW-8 GB Key Chain Spy Product Camcorder(Black)	1
SPYCLOUD Secrete Detective S918-HD-BatPen Pen Spy Product Camcorder(Black)	1
SPYCLOUD Secrete Detective S918-S818-BMW Button Spy Product Camcorder(Black)	1
SPYCLOUD Secrete Detective S918-SteelTable-Clock Clock Spy Product Camcorder(Multicolor)	1
SPYCLOUD Secrete Detective Silver HD Camera Clock Spy Product Camcorder(Silver)	1
SPYCLOUD Secrete Detective Sinita P1 Button Spy Product Camcorder(Black)	1
SPYCLOUD Secrete Detective Spy Wrist Watch Camera Video/Audio Recording,While recording no light Flashes,Inbuilt 4GB memory Camcorder(Silver)	1
SPYCLOUD Secrete Detective Stylish Smile Booch HD Camera Clothes Spy Product Camcorder(Yellow)	1
SPYCLOUD Secrete Detective Trendy Micro Button Spy Product Camcorder(Black)	1
SPYCLOUD Secrete Detective U8 Pen Drive Spy Product Camcorder(Black)	1
SPYCLOUD Secrete Detective USB HD Camera Pen Drive Spy Product Camcorder(Black)	1
SPYCLOUD Secrete Detective USB Stylish Pen Drive Spy Product Camcorder(Black)	1
SPYCLOUD Secrete Detective w00212 Watch Spy Product Camcorder(Black)	1
SPYCLOUD Secrete Detective Wifi MN7 Button Spy Product Camcorder(Black)	1
SPYCLOUD Secrete Detective Yellow Smiley Spy Camera Camcorder(Yellow)	1
spydo Secrete Security Based 13-HI-13 Mirror-Camera Glasses Spy Product Camcorder(Black)	1
spydo Secrete Security Based 16GB 5MP Camera Pen Spy Product Camcorder(Blue)	1
spydo Secrete Security Based 16GBBL1289 Pen Spy Product Camcorder(Black)	1
spydo Secrete Security Based 16Gb Hidden Camera Pen Spy Product Camcorder(Black)	1
spydo Secrete Security Based 16GB Hidden Spy Pen Camera For Video/Photo Recording Camcorder(Black)	1
spydo Secrete Security Based 32GB Hidden Photo/Video Pen Spy Product Camcorder(Blue)	1
spydo Secrete Security Based 32 GB Inbuilt Pen Camera Pen Spy Product Camcorder(Black)	1
spydo Secrete Security Based BD-300-Socket Charger Spy Product Camcorder(Black)	1
spydo Secrete Security Based Black Audio Transmitter For Live Listening Camcorder(Black)	1
spydo Secrete Security Based Black Sports Spy Watch Camcorder(Black)	1
spydo Secrete Security Based Black Spy Button Camera Camcorder(Black)	1
spydo Secrete Security Based Blue-Spy-Pen-32-GB Pen Spy Product Camcorder(Black)	1
spydo Secrete Security Based Camera Watch 4GB for Video/Photo Watch Spy Product Camcorder(Black)	1
spydo Secrete Security Based dv7 Voice Recorder Spy Product Camcorder(Black)	1
spydo Secrete Security Based DV7 Voice Recorder Spy Product Camcorder(Black)	1
spydo Secrete Security Based Electro Black 32 GB Spy Pen Camera Camcorder(Black)	1
spydo Secrete Security Based F01D Watch Spy Product Camcorder(Black)	1
spydo Secrete Security Based FAT32 Voice Recorder Spy Product Camcorder(Black)	1
spydo Secrete Security Based HD-Bat-Pen Pen Spy Product Camcorder(Black)	1
spydo Secrete Security Based HD Night Vision function long duration Charger Camera. Support recording while charging .up to 32 gb support Camcorder(Black)	1
spydo Secrete Security Based HD Quality Hidden Spy Keychain for Video/Photo Recording Camcorder(Black)	1
spydo Secrete Security Based HD-Steelclock-16gb-DVR Clock Spy Product Camcorder(Black)	1
spydo Secrete Security Based Hidden 16GB Spy Pen Camera For Photo/Video Recording Camcorder(Black)	1
spydo Secrete Security Based Hidden 4 GB Spy Pen for Video/Photo Recording with Digital Voice Recorder Camcorder(Black)	1
spydo Secrete Security Based Hidden Button Camera with Inbuilt 4gb Genuine Camcorder(Black)	1
spydo Secrete Security Based Hidden Camera Pen Drive Spy Product Camcorder(Black)	1
spydo Secrete Security Based Hidden Camera Pen for Video/Photo Recording With Built in 32GB Pen Drive Camcorder(Blue)	1
spydo Secrete Security Based Hidden Camera Spy Wrist Watch fro Video/Photo Recording Camcorder(Silver)	1
spydo Secrete Security Based Hidden Pen Drive Camera for Video/ Photo/Audio Recording Camcorder(Black)	1
spydo Secrete Security Based Hidden Pen Drive Camera for Video/Photo/ Recording Camcorder(Black)	1
spydo Secrete Security Based Hidden Slim Button Camera with Inbuilt 4gb Genuine Camcorder(Black)	1
spydo Secrete Security Based Hidden Spy Pen 4GB With Button Camera Camcorder(Black)	1
spydo Secrete Security Based Hidden Spy Pen Camera 4GB with Button Camera for Recording Camcorder(Black)	1
spydo Secrete Security Based Hidden Spy Pen for Video/Photo Recording Built In 16gb Pen Drive Camcorder(Black)	1
spydo Secrete Security Based Inbuilt 16 GB Memory HD Camera Pen Spy Product Camcorder(Black)	1
spydo Secrete Security Based inbuilt Hd Pen Camera Camcorder Spy Product Camcorder(Black)	1
spydo Secrete Security Based J018 Hook Spy Product Camcorder(Black)	1
spydo Secrete Security Based Keychain Camera Key Chain Spy Product Camcorder(Black)	1
spydo Secrete Security Based Live Listening Device and Audio Transmitter -Black Camcorder(Black)	1
spydo Secrete Security Based Mini DV 8 GB Voice Recorder Camcorder(Black)	1
spydo Secrete Security Based mini mp03 Voice Recorder Spy Product Camcorder(Black)	1
spydo Secrete Security Based N-09 GSM BUG Live Listening Device Voice Recorder Spy Product Camcorder(Black)	1
spydo Secrete Security Based Night vison watch_2 Watch Spy Product Camcorder(Black)	1
spydo Secrete Security Based pen_32gb_inbuilt Pen Spy Product Camcorder(Black)	1
spydo Secrete Security Based Pen Camera Pen Spy Product Camcorder(Black)	1
spydo Secrete Security Based Red Spy Pen for Video/Photo Recording built in 4gb Pen Drive Camcorder(Black)	1
spydo Secrete Security Based Round-Steel-Table-Clock Clock Spy Product Camcorder(Silver)	1
spydo Secrete Security Based S818-S918 Key Chain Spy Product Camcorder(Black)	1
spydo Secrete Security Based S918-HD-BatPen Pen Spy Product Camcorder(Black)	1
spydo Secrete Security Based SC-07 16gb sports watch Watch Spy Product Camcorder(Silver)	1
spydo Secrete Security Based (sc) Black Leather Spy Watch Camcorder(Black)	1
spydo Secrete Security Based (sc) Surveillance Based Chain Hand Watch Spy Product Camcorder(Black)	1
spydo Secrete Security Based Silver HD Camera Watch Spy Product Camcorder(Black)	1
spydo Secrete Security Based Slimest Button Camera with Inbuilt 4gb Genuine Camcorder(Black)	1
spydo Secrete Security Based Speck-v13-2 Glasses Spy Product Camcorder(Black)	1
spydo Secrete Security Based Spy Camera Watch Clock Spy Product Camcorder(Black)	1
spydo Secrete Security Based Spy hd Slimmest Button camera inbuilt 4GB Camcorder(Black)	1
spydo Secrete Security Based Spy Wrist Watch Hidden Audio/video Recording .While recording no light Flashes.Inbuilt 4GB memory. Camcorder(Black)	1
spydo Secrete Security Based Spy Wrist Watch Hidden Camera With Audio /Video Recording Inbuilt 16GB Memory. Camcorder(Silver)	1
spydo Secrete Security Based Steel-Wrist-Watch Watch Spy Product Camcorder(Silver)	1
spydo Secrete Security Based Stylish Look C00212 Watch Spy Product Camcorder(Black)	1
spydo Secrete Security Based Stylish USB Pen Drive Spy Product Camcorder(Black)	1
spydo Secrete Security Based Stylish Watch Spy Product Camcorder(Black)	1
spydo Secrete Security Based Trendy Silva32 Pen Spy Product Camcorder(Black)	1
spydo Secrete Security Based USB Button Button Spy Product Camcorder(Black)	1
spydo Secrete Security Based Voice Recorder Spy Product Camcorder(Blue)	1
spydo Secrete Security Based w00212 Watch Spy Product Camcorder(Black)	1
spydo Secrete Security Based White Plastic Socket Spy Camera with Video Recording Camcorder(Black)	1
spydo Secrete Security Based Wifi Mini Drive Headset Spy Product Camcorder(Black)	1
spydo Secrete Security Based World FW4GBL Pen Spy Product Camcorder(Black)	1
spydo Secrete Security Based Yellow Metal Smiley Hidden Camera Camcorder(Yellow)	1
strikers SJ-8000 Ultra HD Action Camera 4K Video Recording 1920x1080p 60fps Go Pro Style Action camera With Wifi 16 Megapixels Sports and Action Camera(Multicolor 16 MP)	1
Sunlight Traders Action Shot Sports Action Waterproof Camcorder 1080P mini HD-CM1S Sports and Action Camera(Black 12 MP)	1
Sunlight Traders Action Shot Sports Action Waterproof Camcorder 1080P mini HD-CM3 Sports and Action Camera(Black 12)	1
TechGear Sound CCTV Camera Audio Pickup Device Advanced Point & Shoot Camera(White)	1
Technomart Cycling / Bike/ Adventure 4K Ultra HD 1080p DV Sports 16Mp Wifi Action Camera Water Resistant 170 Camcorder Camera(Black)	1
TruOm HD 1080p SPORTS CAM(HD) Sports and Action Camera(Silver 1080 MP)	1
VibeX � 1080P Super Shot Action & Sports Cam Holder Sports & Action Camera(Black)	1
"VibeX � 1.5 LCD Waterproof Cam Holder Sports & Action Camera(Black)"""	1
VibeX �� 2.0-Inch Stunt Sports and Underwater Cam Holder Sports & Action Camera(Black)	1
VibeX �� Full HD 12MP 1080P Black Helmet Sports Action Waterproof Cam Holder Sports & Action Camera(Black)	1
VibeX �� Full HD Waterproof Cam Holder Sports & Action Camera(Black)	1
VibeX � Mini Ultra HD 1080P DV Sports Recorder Action Camcorder Waterproof Cam Holder Sports & Action Camera(Black)	1
VibeX �� Mini Underwater 1080p HD Cam Holder Sports & Action Camera(Black)	1
VibeX � Sports Action Cam Holder Sports & Action Camera(Black)	1
VibeX �� Sports Action Waterproof Camcorder 1080P mini HD Cam Holder Sports & Action Camera(Black)	1
VibeX � Waterproof Helmet HD 1080p Cam Holder Sports & Action Camera(Black)	1
VibeX �� Waterproof Sports Cam Holder Sports & Action Camera(Black)	1
Voltegic � 1080P Super Shot Action & Sports Cam Holder Sports & Action Camera(Black)	1
"Voltegic � 1.5 LCD Waterproof Cam Holder Sports & Action Camera(Black)"""	1
"Voltegic � 1.5 LCD Waterproof Sports Action DVR Cam Holder Sports & Action Camera(Black)"""	1
Voltegic �� Full HD Waterproof Cam Holder Sports & Action Camera(Black)	1
Voltegic �� Mini Adventure Sports,Underwater 1080p HD Cam Holder Sports & Action Camera(Black)	1
Voltegic � Mini Ultra HD 1080P DV Sports Recorder Action Camcorder Waterproof Cam Holder Sports & Action Camera(Black)	1
Voltegic �� Mini Underwater 1080p HD Cam Holder Sports & Action Camera(Black)	1
Voltegic � Sports Action Cam Holder Sports & Action Camera(Black)	1
Voltegic �� Sports Action Waterproof Camcorder 1080P mini HD Cam Holder Sports & Action Camera(Black)	1
Voltegic �� Waterproof Sports Cam Holder Sports & Action Camera(Black)	1
Wonder World �� 1080P Cam Holder Sports & Action Camera(Black)	1
"Wonder World �� 1.5 LCD Cam Holder Sports & Action Camera(Black)"""	1
Wonder World �� 2.0-Inch Stunt Sports and Underwater Cam Holder Sports & Action Camera(Black)	1
Wonder World �� Full HD 12MP 1080P Black Helmet Sports Action Waterproof Cam Holder Sports & Action Camera(Black)	1
Wonder World �� Full HD Cam Holder Sports & Action Camera(Black)	1
Wonder World �� Mini Ultra HD 1080P DV Sports Recorder Action Camcorder Waterproof Cam Holder Sports & Action Camera(Black)	1
Wonder World �� Mini Underwater Cam Holder Sports & Action Camera(Black)	1
Wonder World �� Sports Action Cam Holder Sports & Action Camera(Black)	1
Wonder World �� Sports Action Waterproof Camcorder 1080P mini HD Cam Holder Sports & Action Camera(Black)	1
Wonder World �� Waterproof Helmet Cam Holder Sports & Action Camera(Black)	1
Wonder World � Waterproof Helmet HD 1080p Cam Holder Sports & Action Camera(Black)	1
Wonder World �� Waterproof Sports Cam Holder Sports & Action Camera(Black)	1
xiaoyi international Edition Sports Action Camera Sports & Action Camera(Pearl White)	1
Yi YI 4K+ Action Camera YI 4K+ Action Camera 4K/60fps with Waterproof Case Sports and Action Camera(Black 12 MP)	1
Your Deal SJ4000 1080P Full HD 30fps 12 MP CMOS Sensor H.264(Gold)	1
YourDeal SJ4KYDBLK Sports & Action Camera(Black)	1
YourDeal SJ4KYDSIL Sports & Action Camera(Silver)	1
YourDeal SJ4KYDWHT Sports & Action Camera(White)	1
YourDeal SJ4KYDYEL Sports & Action Camera(Yellow)	1
Your Deal Sj6000 Wifi 12 Mp 1080p Hd Sports Dv 170 Degree Wide Angle Car Recorder Diving Camera CMOS-Sensor??(White)	1
Your Deal Wifi 12 Mp 1080p Hd Sports Dv 170 Degree Wide Angle Car Recorder Diving Camera(CMOS-Sensor) CMOS-Sensor Mirrorless Camera(Black)	1
Zakk HD 1080P Sports and Action Camera(Black 12 MP)	1
Zeiss Ze-6105 UV Filter	1
ZVR Powershot Go Pro 1080P Full HD Sports and Action Camera(Gold 12 MP)	1
ZVR ultrashot action 1080p waterproof Sports and Action Camera(Gold, Black 10.4 MP)	1
ZVR ULTRASHOT Go Pro 1080P Waterproof Sports and Action Camera(Black 10.4)	1
